{
  "schema_version": 1,
  "record_type": "asset",
  "asset_id": "asset_synthetic_video_001",
  "source_id": "source_njp_synthetic",
  "public_url": "https://njpvideo.ggcf.kr/synthetic/item-001",
  "media_type": "video/mp4",
  "byte_size": 1024,
  "sha256": "aaaaaaaaaaaaaaaaaaaaaaaaaaaaaaaaaaaaaaaaaaaaaaaaaaaaaaaaaaaaaaaa",
  "metadata": {
    "label": "synthetic asset"
  }
}
